"Title","Link","Published","Source","Content"
"Scott Pilgrim vs. The World: The Game is still one of the best licensed games around","https://www.theverge.com/2021/1/13/22228652/scott-pilgrim-vs-the-world-the-game-review-switch-stadia-ps4-xbox","Wed, 13 Jan 2021 08:00:00 GMT","The Verge","By  Andrew Webster, an entertainment editor covering streaming, virtual worlds, and every single Pokémon video game. Andrew joined The Verge in 2012, writing over 4,000 stories.
It’s hard to think of a licensed game that fit its source material better than Scott Pilgrim vs. The World: The Game. First released in 2010, the game felt exactly like an interactive version of Bryan Lee O’Malley’s cult comic book. The story was pared down, but the vibe was the same, thanks to incredible character sprites from Paul Robertson, a banging chiptune soundtrack from Anamanaguchi, and classic beat ‘em up action from a small team at Ubisoft. The problem was actually playing it: a few years after it debuted on the PS3 and Xbox 360, the game was delisted from digital stores.
This week, that finally changes. More than a decade after it first came out, Scott Pilgrim vs. The World: The Game is coming to a huge range of new platforms: the Nintendo Switch, PS4, Xbox One, PC, and even Google Stadia. The new version bundles all of the original downloadable content — no paying extra for Knives Chau — and introduces online co-op, but otherwise it’s the same game. Which is exactly as it should be.
So what’s the big deal? For starters, a video game adaptation just makes too much sense. (The game is based on the comics, not the movie.) Not only is Scott Pilgrim jammed with gaming references, it’s structured like a classic game, too, with seven main bosses — in this case, Ramona’s evil exes — to defeat along the way. It all fits very well with a 16-bit style game.
The Scott Pilgrim game plays a lot like Streets of Rage or Double Dragon. You wander through city streets and movie sets, fighting a whole bunch of “bad guys,” ranging from bus drivers to paparazzi. You can jump, punch, and kick, and pick up many objects to use as weapons, whether it’s a snowball or a baseball bat. You can also play as most of the main cast of characters, and they’ll each learn some new abilities as you progress. There are even level and character select screens ripped straight out of the 8-bit Super Mario games, and Street Fighter-style car smashing mini-games.
The gameplay is solid, if not as deep as some of its contemporaries or more recent titles like Streets of Rage 4. But, like the movie version of Scott Pilgrim, it’s also incredibly stylish. Fighting enemies is really just an excuse to see the gorgeous pixel art and listen to the amazing soundtrack. Sometimes, after clearing out a wave of enemies, I’ll just sit for a second to soak in the sound and visuals. I’ve been playing on the PS5 via backwards compatibility, and the experience holds up extremely well.
I also have to note that Scott Pilgrim vs. The World: The Game is the most prominent video game ever to be set in my hometown of Toronto, so it holds a special place personally. I can’t think of another game where you have to dodge TTC buses or collect toonies ($2 coins) to buy a poutine. My friends from New York, London, and Tokyo can play through huge, nearly photo-realistic versions of their homes, but I’m pretty happy to stick with what Scott Pilgrim has to offer. It’s certainly very Canadian.
Time has been surprisingly kind to the Scott Pilgrim franchise (even if Scott remains a dick). The books hold up well, and the movie went from a box-office bomb to a cult classic; Kid Cudi even sampled it on his most recent album. Meanwhile, the game now has a second chance after being doomed to obscurity years ago. If nothing else, at least O’Malley can finally stop answering questions about it.
Scott Pilgrim vs. The World: The Game launches January 14th on the Switch, PS4, Xbox One, PC, and Stadia.
 / Sign up for Verge Deals to get deals on products we've tested sent to your inbox weekly.
The Verge is a vox media network
© 2024 Vox Media, LLC. All Rights Reserved"
"GameStop stock halts trading after Reddit drama","https://www.theverge.com/2021/1/22/22244900/game-stop-stock-halted-trading-volatility","Fri, 22 Jan 2021 08:00:00 GMT","The Verge","By  Kim Lyons
Trading in stock of video game retailer GameStop (GME) was halted briefly Friday, as it soared more than 70 percent, due partly to the enthusiastic support of a group of Reddit day traders. 
The stock is up more than 250 percent year to date, rising sharply last week after GameStop announced Chewy CEO Ryan Cohen was joining its board, CNBC reported. Short-seller Citron Research predicted the price would drop, but members of the Reddit board r/wallstreetbets, who had been generating interest in the stock, criticized Citron on the Reddit message board and continued praising the stock on social media. 
GameStop is the most-shorted stock in the market
The hype generated by r/wallstreetbets helped create what’s known as a “short squeeze” on GameStop’s stock. A short squeeze works like this: some investors, known as shorts, essentially bet that a company’s stock will fall. These investors borrow stock from other investors and sell it — with plans to buy it back when the prices fall and then return it to the original owner. However, the problem with shorting is that one’s losses are theoretically infinite; if a stock begins an upward run, some short sellers will abandon their short and buy shares at the higher price to return. This, in turn, makes the stock go higher, burning any other shorts who remain in the stock, some of whom may, in turn, choose to cover their own shorts. 
GameStop is the most-shorted stock in the market, CNBC said, citing FactSet. More than 138 percent of its shares are sold short — making it a prime target for a short squeeze. GameStop’s Reddit-related surge triggered a circuit breaker stoppage when it rose 69 percent (nice) on Friday around 12:45PM ET. 
Citron said Friday it would no longer comment on the GameStop stock because of “the angry mob who owns this stock.” Citron Research editor Andrew Left wrote in a note to readers that the backlash had included criminal activity he planned to report to the Securities and Exchange Commission, which included harassment of minor children as well as financial crimes. 
According to Bloomberg, the past 10 days has been the most volatile period in GameStop’s stock in its history. At the close of markets Friday, GameStop was up more than 50 percent from its Thursday close, with a market cap of $4.5 billion. 
 / Sign up for Verge Deals to get deals on products we've tested sent to your inbox weekly.
The Verge is a vox media network
© 2024 Vox Media, LLC. All Rights Reserved"
"Robinhood denies claims that it sold GameStop shares out from under its traders","https://www.theverge.com/2021/1/28/22254857/robinhood-gamestop-amc-shares-sold-surprised-users","Thu, 28 Jan 2021 08:00:00 GMT","The Verge","By  Jacob Kastrenakes, a deputy editor who oversees tech and news coverage. Since joining The Verge in 2012, he’s published 5,000+ stories and is the founding editor of the creators desk. 
No, Robinhood tells The Verge, it didn’t sell off full shares of GameStop, AMC, and other buzzy stocks without permission from its traders. 
That contradicts the stories of twelve people who spoke with The Verge, saying that the app unexpectedly sold off their holdings in some of these companies. Quite a number of Robinhood users expressed their surprise on social media today that the app was selling off their stakes, and we tracked down a dozen of them. These traders didn’t believe they had prompted the sales, and they said they weren’t aware of anything on their account that would have automatically triggered them. 
“I didn’t have any triggers to sell the stock whether it went up or down. I certainly wouldn’t have put it at $197 when it had just been almost $500,” Jett Flores, who said he was holding stock in GameStop and AMC through Robinhood, told The Verge.
The small traders planned to hold onto their stock, rather than sell
A spokesperson for Robinhood said these small sellers are wrong about how their shares were sold. “I can confirm that claims that Robinhood proactively sold customers’ shares outside of our standard margin-related sellouts or options assignment procedures are false,” the spokesperson told The Verge.
On Wednesday, Robinhood warned some investors with options in GameStop and AMC that it may automatically sell off their stakes to reduce risk, the spokesperson said. But these investors told The Verge they didn’t have options in GameStop or AMC and hadn’t purchased the stocks on margin. They had purchased the shares outright, they said, and were planning to hold onto them.
Margin orders occur when an investor borrows money from the broker (in this case Robinhood) to complete a sale, and brokers can call in those shares if they’re worried the investor can’t pay up. According to Robinhood, most of its actions have been calling in options to purchase shares — a more aggressive move, but not unprecedented. But if users fully owned their shares, as these traders claim they did, selling the holdings would be far more unusual.
The Verge saw screenshots from six traders indicating that their purchase of GameStop or AMC stock had been filled within Robinhood. Six traders sent screenshots showing that their stock in these companies had been sold, with four clearly indicating that they had been sold today. Another trader sent screenshots showing a purchase of Naked Brand stock being filled and then sold within the app. The screenshots don’t indicate how the purchases were funded or how the sales were initiated, but in several of them the app displays a message saying, “We’ve received your order to sell [#] shares of [stock] at the best available price.”
“I certainly wouldn’t have put it at $197 when it had just been almost $500.”
Traders who spoke with The Verge said they were disappointed to lose their stake in these companies. The traders had been planning to keep the stock for longer, and several said they certainly wouldn’t have sold it at the point that they believe Robinhood pushed through the transaction, as GameStop’s stock was faltering from a nearly $500 high.
“It’s extremely dishonest trade on their part and unacceptable,” Ian Q., who said Robinhood unexpectedly sold his shares in GameStop this morning, told The Verge.
The surprise selloff isn’t happening to everyone — plenty of people on the r/WallStreetBets subreddit (and one person I know, who told me they purchased GameStop stock days ago) say they weren’t impacted. And though traders may be outraged by the surprise, Robinhood’s terms of service grant it permission to close a trader’s position under a number of circumstances.
While r/WallStreetBets has been at the center of the frenzy around GameStop and AMC stocks, Robinhood has been the tool of choice for many of the small-time and brand new traders jumping in to take part. But this morning, Robinhood blocked new purchases of stock from GameStop, AMC, BlackBerry, Nokia, and others that were spiking in large part because of purchases coming through the app. The company is now facing widespread backlash from users, celebrities, and politicians, and it’s announced plans to re-open purchases on a “limited” basis on Friday.
It’s still not clear what happened to cause these users’ stakes to be sold off today. But at the very least, it means Robinhood has even more unhappy customers.
 / Sign up for Verge Deals to get deals on products we've tested sent to your inbox weekly.
The Verge is a vox media network
© 2024 Vox Media, LLC. All Rights Reserved"
"RetroN Sq is a cube-shaped console for playing Game Boy titles on your TV","https://www.theverge.com/circuitbreaker/2021/2/17/22288130/retron-sq-hyperkin-game-boy-retro-console-release-date-price","Wed, 17 Feb 2021 08:00:00 GMT","The Verge","By  Taylor Lyles
Hyperkin is best known for making gaming peripherals, but it also creates clones of consoles that allow you to play retro games in modern resolutions. Now it is releasing a new retro console that will allow you to play Game Boy games on your TV. Hyperkin's RetroN Sq (Square) is a console that will allow you to play Game Boy, GBC, and GBA cartridges.
The RetroN Square includes one wired USB “Scout” controller with a shape similar to a SNES controller. Instead of composite video hook-ups, the RetroN Sq connects to a TV via HDMI with games upscaled to 720p resolution; there’s also a switch that will allow you to switch the aspect ratio to either 4:3 or 16:9, depending on your preference. 
The console will allow you to natively play Game Boy and GBC cartridges, while GBA games are listed as a “beta feature,” but it does not note which GBA games are compatible. The back of the console includes a microSD card slot, allowing you to store firmware for the system.
I know the official product name hints it is supposed to be a square-shaped console, yet the design looks more like a color, compact Nintendo GameCube that strictly plays Game Boy cartridges, but I’ll let you be the judge of that. 
1/4
1/4
Hyperkin’s RetroN Sq will release on March 25th for $75. But if you already know you want to buy one, you can preorder your unit at Hyperkin’s website. The gadget comes in two colors: “black gold” and “hyper beach,” which to me looks more like a turquoise color. 
 / Sign up for Verge Deals to get deals on products we've tested sent to your inbox weekly.
The Verge is a vox media network
© 2024 Vox Media, LLC. All Rights Reserved"
