"Title","Link","Published","Source","Content"
"How r/WallStreetBets gamed the stock of GameStop","https://www.theverge.com/22251427/reddit-gamestop-stock-short-wallstreetbets-robinhood-wall-street","Wed, 27 Jan 2021 08:00:00 GMT","The Verge","By  Elizabeth Lopatto, a reporter who writes about tech, money, and human behavior. She joined The Verge in 2014 as science editor. Previously, she was a reporter at Bloomberg. 
There are three things to remember as you watch the chaos unfolding with GameStop’s stock price. First, Wall Street is just what happens when you mix money with feelings. Second, the internet is real life. And third, the Street always wins, especially if you’re trading with Robinhood.
If you haven’t been paying attention, GameStop’s stock has been soaring in a remarkably volatile fashion; on January 22nd, GameStop zoomed upward 69 percent (nice) before it triggered a circuit breaker halt. The following Monday, January 25th, GameStop trading was halted nine times.
The idea was to punish short-sellers, and for the little guys to pummel Wall Street
On the surface, this doesn’t make sense. GameStop, founded a year before Blockbuster, is part of a dwindling cohort of IRL businesses that are being starved by online marketplaces. These days, you can just buy video games over the internet instead of going to a soul-killing strip mall in Iowa City to buy a physical copy of the game. GameStop’s business has been suffering as a result.
Currently, many people are at home and bored, and consequently, interest in day trading has shot through the roof. There is a Reddit forum for this, r/WallStreetBets, which describes itself as being “like 4chan found a Bloomberg Terminal.” A year ago, a user called delaneydi argued that GameStop was underpriced by the market. For a while, the idea that r/WallStreetBets would take over GameStop was a joke — but then it turned serious, Bloomberg reported. The idea was to punish short-sellers, and for the little guys to pummel Wall Street.
If you think GameStop will fail and the stock will go down, or even that the company will go bankrupt, there’s a way to make money on that. Typically, this is done by short selling — a practice where you borrow shares for a fee and sell them for (ideally) a high price, then buy them back at (ideally) a lower price to return them. This can make you a lot of money, especially if the company goes bankrupt and you don’t have to return the stock!
The thing about short selling, though, is that you lose money if the stock goes up, and your losses are potentially infinite if the stock keeps going up. There are several other bad things that can also happen, such as an increase in fees or the original investor wanting their stock back. This means some shorts will be forced to “cover,” or buy the stock back at a high price, which sends the price even higher.
For retail investors, this process has gotten easier and cheaper
Right now, more people are betting against GameStop than betting it will succeed. “Short interest is 71.2 million shares, while GameStop has only 69.7 million shares outstanding,” Matt Levine of Bloomberg points out. Some people will notice that kind of thing and think, Hm, this stock is prime for a short squeeze! Basically, because so many people are short, it may be possible to trigger a chain reaction where you buy enough stock to send the price up, forcing some shorts to cover, sending the price up further, forcing more shorts to cover, and so on. 
For retail investors, this process has gotten easier and cheaper because of apps such as Robinhood. In addition to letting you buy and sell stock, you can easily buy an option for stock, instead of the stock itself. If you are feeling confident in a stock, you can buy a call option — which lets you buy a stock at a specific price on a specific date.
Let’s say my fake investing firm wants to buy a call option on Company X. Currently, shares of Company X are trading at $10. I feel confident in Company X, so I buy options that let me buy 100 shares of Company X stock for $25 a share on March 1st. This contract is usually cheaper than the share price.
So let’s say Company X goes on an epic run in February, and by February 15th, it’s up to $50 a share. I can sell my options for more than I paid for them, if I want. Or I can continue to hold onto them until March 1st, when I take delivery of the 100 shares, which are now trading at $55 a share, and immediately sell them. As a result, I make a profit of $30 per share, minus whatever fees I paid for the options.
Stocks are memes now, and you trade them to show off to your friends
On the other hand, maybe I bet badly and Company X only gets up to $20. In that case, my losses are limited to whatever fees I paid for my options — I just never buy the shares. This makes options a riskier bet than just buying Company X stock directly, because I might just lose all the money I spent on the options, instead of at least getting to own the stock. But it means there’s a lot more upside as well, because I didn’t have to spend all the money on the stock upfront. If risk is your idea of fun, options are great!
Now, someone has to be on the other end of my trade. The outfit that sold me the options is going to try to reduce the risk that my options will hurt them, and they will do this by buying stock in Company X. That makes the stock go up, and the further up the stock goes, the more stock my counterparty will have to buy. 
Options were once a fairly sophisticated thing to trade — something ordinary people didn’t really do. But Robinhood makes the option trades easy and free. Plus, there’s a social aspect to the trades — which is where r/WallStreetBets come in. Stocks are memes now, and you trade them to show off to your friends.
Day traders, such as the ones on r/WallStreetBets, are typically held in contempt by professional traders, and they are acutely aware of this. The professional short-sellers who created the possibility of a short squeeze underestimated the day traders’ sophistication, and r/WallStreetBets pounced. Time to troll Wall Street out of a fuckload of money! 
GameStop’s short-sellers have been trolled out of about $5 billion in 2021
The fine people of r/WallStreetBets decided GameStop was undervalued, and the stock would go up, so they put up a bunch of posts about how they were buying GameStop options. This drove up the stock price for GameStop, as their counterparties had to load up on stock to balance, and then more stock as more people bought options and so on. The soaring stock meant some shorts had to cover, sending the stock up further. As of January 26th, short-sellers have been trolled out of about $5 billion in 2021, just from their GameStop positions alone.
What does Robinhood have to do with this? Well, it makes options trading much more accessible to retail investors — but there’s something else. Trades on Robinhood are free! But Robinhood isn’t offering free trades to be nice; the company gets paid by some big-time investors such as Citadel Securities to see what retail investors are doing. This phenomenon, which other brokerages are engaged in as well, is called payment for order flow. Citadel Securities makes its money on these orders by “automatically taking the other side of the order, then returning to the market to flip the trade. It pockets the difference between the price to buy and sell, known as the spread,” according to the Financial Times.
The argument in favor of this practice is, essentially, retail investors get better prices than they would on the open market, Bloomberg’s Levine writes. The practice is controversial, though, because some critics say it harms investors. It’s theoretically possible to “‘front run’ orders by, for example, jumping ahead of a customer’s stock purchase to buy it themselves, making a small gain if the share price increases,” the Financial Times explains. “There is no suggestion that Citadel Securities engages in such activity, which is prohibited by SEC.” 
Robinhood got in trouble with the SEC for “misleading statements and omissions” about how it made its money by selling the orders its traders made to other firms. According to the SEC, Robinhood investors got second-rate prices, which cost them a collective $34.1 million. The company paid a $65 million fine in December to settle charges, and the practices the SEC objected to “do not reflect Robinhood today,” Dan Gallagher, the brokerage’s chief legal officer, told Business Insider.
Wall Street can also get in on screwing Wall Street
When asked for comment, Robinhood referred to an op-ed published by Vlad Tenev, the company’s CEO and co-founder. The company says its customers are mostly “buy and hold”  investors, not reckless ones. The op-ed said nothing about payment for order flow, and Robinhood declined to comment on the practice in a follow-up email.
Citadel Securities is winning on this, though! Last June, the company was responsible for 40 percent of shares traded by retail investors, the Financial Times wrote, citing Piper Sandler. It doesn’t just get Robinhood’s orders either — TD Ameritrade and Charles Schwab also work with Citadel Securities. “Not only are retail market makers getting increased trading volume, they are likely getting increased profitability per trade,” Tyler Gellasch, executive director of Healthy Markets Association, told the FT.
Which means that Wall Street can also get in on screwing Wall Street. And it’s not just Citadel Securities. I’d be very surprised if high-frequency trading algorithms weren’t also getting in on the fun. Plus, Chamath Palihapitiya, the Silicon Valley SPAC icon, has decided to yolo along with the Redditors. (“Yolo” as a verb appears to be part of the r/WallStreetBets peculiar parlance.) Elon Musk, a man who notoriously hates short-sellers, is also observing the chaos.
At least one Wall Street firm has taken heavy losses — Melvin Capital Management, which was shorting GameStop, among other bets. It’s been bailed out by Citadel, which, confusingly, is not the same thing as Citadel Securities. (Citadel is a hedge fund, not a market maker.) Both firms were founded by the same guy, though: Ken Griffin. And by bailing out Melvin, Griffin got “a rare opportunity to invest in a talented manager on the cheap,” according to Bloomberg.
What does this have to do with GameStop itself? Absolutely nothing — this is a weird game now. And the market’s frothy, too; in July, I joined Robinhood to see how it works. The Verge’s ethics policy forbids us from directly trading stock in companies we cover, so for research purposes I picked six stocks that belong to companies I don’t cover because their earnings were next on the calendar. (I actually don’t know what several of them do.) I am a buy-and-hold investor because I am a bore, but as of today I’m a bore who’s up 30 percent. One more time: I know nothing about these companies except that I won’t have to write about them. It’s easy to feel like a genius in a bull market, and a lot of first-time day traders are probably very bullish on their investing sense right now.
At this point you may be wondering whether what r/WallStreetBets is doing is illegal — after all, it’s a group of people trying to artificially drive up a stock price in order to sell for outsized profits. And the answer is: well, maybe? It definitely seems like a pump-and-dump scheme, but — this part is crucial — no one’s lying, as Bloomberg’s Levine points out. Theoretically, the SEC could chase down the r/WallStreetBets investors, since no one’s really anonymous on the internet, but this seems like a lot of effort for what is not actually a slam-dunk case. It is “an enforcement nightmare,” James Cox, a professor at Duke University School of Law, tells Bloomberg.
it’s not just GameStop anymore
Also, GameStop’s shorts seem undeterred — as some older shorts are getting out of the market, they’re being replaced by new ones. Perhaps this is because they are anticipating the “dump” portion of the pump-and-dump scheme; perhaps this is because they’re awaiting quarterly earnings, which usually tanks GameStop’s stock. Maybe they’re just having fun, too!
But: it’s not just GameStop anymore. r/WallStreetBets is yoloing its way into electric carmaker Nio, OG tech company Blackberry, and AMC, the movie theater chain. And if those day traders are doing it, then the market makers that buy the order flow from Robinhood are yoloing along for the ride. And one thing is clear: what Citadel Securities is doing is legal.
So what happens next? I don’t know — but I suspect that someone on Wall Street will find a way to make money on it.
 / Sign up for Verge Deals to get deals on products we've tested sent to your inbox weekly.
The Verge is a vox media network
© 2024 Vox Media, LLC. All Rights Reserved"
"More than half of Americans turned to video games during lockdown","https://www.theverge.com/2021/1/6/22215786/video-games-covid-19-animal-crossing-among-us","Wed, 06 Jan 2021 08:00:00 GMT","The Verge","By  Megan Farokhmanesh
With 2020 consumed almost entirely by the COVID-19 pandemic, more than half of US residents turned to video games to fill the time. According to Nielsen company SuperData’s 2020 year in review, 55 percent of people picked up video games — out of boredom, to escape the real world, to socialize — during the first phase of lockdowns. 
The shift points to a larger one in entertainment. Movie theaters, sports, plays, and more have been largely inaccessible, if not outright dangerous to public health. Just as streaming, both of the Twitch and Netflix variety, became a huge source of entertainment, so did games — especially for adults. According to SuperData, 66 percent of consumers from 18 to 24 played more console games, while 60 percent played more mobile titles. Unsurprisingly, buyers also tended toward digital purchases.
SuperData reports that 27 percent of people — about 1 in 4 — played games to stay in touch with each other. In 2020, games like Animal Crossing: New Horizons and Among Us became cultural touchstones. Animal Crossing was the hit of the early pandemic, while Among Us had nearly half a billion players in November alone. Politicians like Joe Biden and Alexandria Ocasio-Cortez capitalized on their popularity to raise awareness for the year’s presidential election. Even Pokémon Go managed to adapt to the pandemic and grow 39 percent year over year, thanks to Niantic’s updates.
As physical spaces disappeared, video games became one of the few places for people to spend time together — whether that was to enjoy virtual concerts in Fortnite, learn how to vote, or just hang out. SuperData estimates that digital games alone garnered $126.6 billion over the course of the year. The numbers may not spike this year as much as they did in 2020, but SuperData predicts “the long-term habits formed during lockdown are here to stay.”
 / Sign up for Verge Deals to get deals on products we've tested sent to your inbox weekly.
The Verge is a vox media network
© 2024 Vox Media, LLC. All Rights Reserved"
"Plex is launching a game subscription service filled with Atari games","https://www.theverge.com/2021/1/26/22250654/plex-game-subscription-service-arcade-atari","Tue, 26 Jan 2021 08:00:00 GMT","The Verge","By  Mitchell Clark
Plex, well known as a service for streaming movies, music, and TV shows from your own computer, is now adding another thing you can stream: video games (via Protocol). Plex announced the new service, called Plex Arcade, on its blog and also launched a website for it. The service will cost $3 a month if you’re a Plex Pass subscriber, and $5 a month if you’re not. 
Instead of focusing on modern console or phone games like its competitors, Plex lets you play Atari games. It’s taking the arcade name seriously, as you can play arcade classics from Atari, like Centipede, Super Breakout, and Missile Command, as well as games from the Atari 2600 and 7800. Overall, there are 27 games available on the service.
Unlike other game subscription services where you can simply sign up from your console and start playing, Plex Arcade has a few requirements. First is a Plex media server running on a Windows or macOS computer. There isn’t Linux support because Plex is using Parsec to stream the gameplay. 
This means that you’ll have to sign up for a Parsec account, if you don’t already have one, and log in to it on Plex. There is a bit more freedom when it comes to what you can stream the games to, as Android devices and TVs are supported, as well as Google Chrome and Apple’s iOS and tvOS. Plex says you can play with “just about any Bluetooth-enabled controller.”
The service also supports you adding your own emulators and ROMs, which is nice, but it’s overall a bit of a tough sell. Even at the Plex Pass price of $3 a month, you’re paying a lot for games that, at this point, can basically run on a microwave. To be fair, it does let you run them on something like an iPhone or Apple TV, but the games are readily available on Android and PC. 
If you’re interested in playing them for nostalgic purposes, it could be worth a try, but you may want to set aside some time for it — getting it set up was an exercise in frustration for me, and I wasn’t ever actually able to successfully play a game. (The iOS and tvOS clients got stuck at a loading spinner, and keyboard controls didn’t seem to do anything when trying to play on Chrome.)
If you want to try it out for yourself, there’s a free seven-day trial, though you will have to put in a credit card or link your PayPal. Plex says this is mostly a skunk works-type project, saying in the blog post that “[i]f there’s interest and we see some subs, it’ll grow into the glorious pheasant we know it can be. But if you guys drop the ball, it’ll die on the vine like a stomped ass goomba.” Harsh.
 / Sign up for Verge Deals to get deals on products we've tested sent to your inbox weekly.
The Verge is a vox media network
© 2024 Vox Media, LLC. All Rights Reserved"
"The Oatmeal’s creator says his new game is a way to ‘play the comic’","https://www.theverge.com/2021/2/20/22291686/the-oatmeal-creator-kitty-letter-matthew-inman-play-comic","Sat, 20 Feb 2021 08:00:00 GMT","The Verge","By  Jay Peters, a news editor who writes about technology, video games, and virtual worlds. He’s submitted several accepted emoji proposals to the Unicode Consortium.
The creator of The Oatmeal, Matthew Inman, released a new cat-themed mobile word game called Kitty Letter earlier this week that feels like playing one of his silly comic strips. That feeling was intentional, Inman told me.
“My comics have always been rhetorical,” he said. “You don’t interact with the comic, you have no say in it, you’re just experiencing it. So, with [Kitty Letter], I got a chance to introduce some elements where people get to play the comic, and I thought that was a lot of fun.”
Kitty Letter has a structure that Inman described as “Scrabble combined with Clash Royale.” Your goal is to beat your opponent by spelling words from a combination of letters at the bottom of your phone’s screen. When you spell a word, you’ll send a small army of cats up an invisible “lane” toward your opponent. Meanwhile, your opponent is sending armies of cats to try and defeat you.
The game was actually going to be multiplayer-only at first, Inman told me. This might be surprising for those who’ve played the game, since it has a robust story mode spanning 13 chapters. But that story mode was born from creating the game’s tutorial, said Inman.
“I started drawing this tutorial on how to play, and then the tutorial became that single-player mode, where you have this neighbor that moves in and tells the whole story about him,” Inman said. But then, he realized, “I got in too deep. I had written all this stuff, I was like, ‘I have to end this,’ and I ended up writing like 12 chapters. But it became my favorite part of the whole thing.”
Inman also discussed the game’s free-to-play model, which is very generous. Unlike many free-to-play games, Kitty Letter’s single-player story mode and multiplayer are completely free, with no restrictions. The decision to offer all of that came from what Inman disliked about other free games.
“I play free-to-play games, but I play them because I like the games,” Inman said. “The actual mechanics involved, like grinding and unlocking chests and getting gems and coins, I hate them. I fucking hate them. If [developers] were like, ‘pay us $20 and we’ll give you everything,’ I would do that. I much prefer that model.” 
The game does offer paid cosmetics for multiplayer, but they don’t provide any gameplay benefit and they’re buried in a menu. And Inman says that revenue from them has been “pretty much non-existent.” 
Inman acknowledged that he can offer the game largely for free because of his other successful ventures, which include The Oatmeal and the hugely successful card game Exploding Kittens. “I’m not just some altruistic guy that doesn’t want to make a living from his work,” he said. “To be completely candid, we make a great living from our card games, and we make a great living from some of the other things that I do. With [Kitty Letter], it felt like we could just get away with making it as enjoyable as possible.
“This app more generates that currency of — and this is so fucking corny — currency of love and joy, like you have a joyful experience with the game,” he said. “So, in turn, you love Exploding Kittens more, and maybe one day, if you want to buy a card game from us, you can.” It’s a business model similar to that of The Oatmeal. Inman offers the comics for free online, but sells books and has offered merch. 
“It was cats from day one”
Inman has a lot of ideas for what’s next for the game. He’d like to improve the arcade mode, add more single-player levels, and squash bugs. He’d also like to port the game to Steam and the Nintendo Switch, but those might be a little further away. “I would probably call it six months,” he said.
And I had to ask: were cats always the focus of the game?
“It was cats from day one,” Inman said. “It was called Cats Royale, originally.”
 / Sign up for Verge Deals to get deals on products we've tested sent to your inbox weekly.
The Verge is a vox media network
© 2024 Vox Media, LLC. All Rights Reserved"
