"Title","Link","Published","Source","Content"
"Sony now lets you store — but not play — PS5 games on external hard drives","https://www.theverge.com/2021/4/13/22381494/sony-ps5-april-update-games-external-usb-storage-social-features","Tue, 13 Apr 2021 07:00:00 GMT","The Verge","By  Chaim Gartenberg
Sony has released its April update for the PlayStation 5, adding several key features to the next-generation console, including the long-awaited ability to store — but crucially, not play — PS5 games on an external hard drive.
The PS5 only offers 825GB of storage (with just 667GB of usable space when formatted with the operating system and other essential files), which means that even just a few massive next-gen games can quickly eat up your entire SSD. Sony has attempted to alleviate the issue by allowing players to stash backward-compatible PS4 titles on external drives, but until now, it hasn’t offered the same option for PS5 games. 
Unfortunately, unlike PS4 titles, Sony won’t allow players to actually play those PS5 games from an external drive. “Because PS5 games are designed to take advantage of the console’s ultra high-speed SSD,” the company explains, you’ll still have to copy them back over to the console’s main SSD before you can play them. Still, Sony does say that the local data copy should be faster than reinstalling it from the internet or copying games from a disc.
All of this is still a stop-gap measure until Sony manages to enable the PS5’s M.2 expansion slot, which will eventually allow players to add usable extra storage that can both store and play next-generation games. There’s no news on that update in Sony’s announcement, but an earlier report from Bloomberg says that it’ll arrive this summer. 
Along with the new storage option, the April update also adds several other key features to the PlayStation 5. There are better options for quickly disabling in-game chat on a system level — something that should help prevent the kinds of issues that dogged Destruction: AllStars at launch. Users can also adjust overly loud or quiet players individually. 
Sony is also adding the option for players to search their library of purchased games, as well as the option to hide games in their library, which should help organization. There’s also a new feature for developers that will allow games to pre-download updates when the console is in rest mode for faster updates.
Related: 
 / Sign up for Verge Deals to get deals on products we've tested sent to your inbox weekly.
The Verge is a vox media network
© 2024 Vox Media, LLC. All Rights Reserved"
"Why game developers can’t get a handle on doors","https://www.theverge.com/22328169/game-development-doors-design-difficult","Fri, 12 Mar 2021 08:00:00 GMT","The Verge","By  Megan Farokhmanesh
The best kind of door in a video game is the one no one remembers. Sure, everyone can appreciate a big, beautiful door with great animations, says Owlchemy Labs developer Pete Galbraith. But in a video game, doors are often synonymous with a massive design headache. Forgettable means a developer has done their job well. “If it fits into the environment, makes sense for its context, and works exactly how the player expects, then in that instant it was simply a door as real as any other in the player’s real life,” says Galbraith. “I can’t imagine higher praise for a door in a game.”
Over the past week, dozens of developers across multiple disciplines and teams shared their frustrations on Twitter. Death Trash creator Stephan Hövelbrinks explained that doors “have all sorts of possible bugs.” The Last of Us Part II co-game director Kurt Margenau called it “the thing that took the longest to get right.” How doors work is different during “combat tension,” when players are mid-encounter, vs. not, for example: doors slowly close automatically during combat, but remain open during exploration. “If a player is going to open a door, it can’t just magically fly open, the character has to reach to the doorknob and push it open,” Margenau explained in one tweet. “But what about closing it behind you? How do you do that while sprinting?”
If a door hits an NPC, does the door stop, or does the NPC move? 
Doors aren’t the only ordinary object developers struggle with. Developers The Verge spoke to point to objects like ropes or mirror. After Half-Life: Alyx’s release, one developer on the project spoke at length about how they managed to make the bottles of booze look so realistic. Designer Liz England points to ladders, elevators, and moving platforms as well. “I think doors themselves tend to get a much bigger reputation for being terrible because they are (1) so much more common in the real world (I use doors every single day!), and (2) are much more common, then, in games, so more people can use it as a touchstone for ‘unexpectedly difficult interactivity,’” England tells The Verge. “I’ve never had to implement a mirror or a rope, but I have had my fair share of doors.”
A door isn’t exactly mankind’s best or even smartest invention in the real world. It’s a comically simple concept — open big rectangle for entry or exit — that in development becomes a team-wide problem. As Crystal Dynamics game director Will Kerslake put it in a message to The Verge, there are “so many issues with doors.” In one example, touching specifically on animation, Kerslake explained that doors can open toward or away from you; handles can be on either side. “If you can engage with that door from different states, like crouch or sprinting, then that’s an additional set of animations,” he says. “A door you pull open, requires you to back up in the real world to step out of the way, that’s another set of issues. In a first-person game you can animate the door and not the player, and this is easier. In a high-fidelity third-person game there is an expectation that the player’s hand will move to the handle.” And the players’ location and angle when they engage with any door can and will vary.  
Other problems might involve several players all scrabbling for a door at the same time, or even non-player characters. If a door hits an NPC, does the door stop, or does the NPC move? “The choices here can cause all kinds of bugs depending on your game,” says Kerslake.
It’s not that making doors in a video game is an impossible task. For some developers, it’s just not worth the trouble. “As a result many games avoid doors in gameplay, you’d be surprised at how many games don’t have interactive doors at all,” says Keslake. “Lots of doorways, but the important doors are missing or already open. The next step up in complexity is doors used only as progress gates, they open only and then can’t be closed again.” 
“you’d be surprised at how many games don’t have interactive doors at all”
Technical points, of which there are many, set aside, how players process the digital representation of a door matters. Everyone knows how a door works and therefore has a subconscious understanding and expectation of how they move, sound, look. The level of accuracy needed for a player to believe the door is a door is higher for a common object than a fantasy one, says Galbraith. 
“Our ideas of how we interact with them are incredibly clear due to the cognitive reinforcement we have received from interacting with them so often in a variety of different ways. For doors like the ones in our homes, we subconsciously learn the minute details of how they act, such as the rate at which they close or how much we can move them while they are locked. So when we see a door in a game that closes too fast or without friction or when there’s a locked door where the handle doesn’t jiggle and make a sound we’ll notice that something isn’t quite right about it.”
You can still fib it a little. While most doors only go in one direction, for example, game doors will often swing either way. “When these sorts of virtual doors look, sound, and behave like regular doors, then they hit a level of mental acceptance with the player that allows the player to continue without questioning why every door in the game just so happens to open away from them,” Galbraith says. “To them it’s just a weird coincidence that the brain subconsciously chooses to ignore.”
Doors aren’t just an aesthetic or immersion technique in video games; often they serve as part of level design. They’re gates that keep players from moving on until they’ve finished a puzzle or beaten a boss; they can act as markers for the player’s progress, build tension, or act as cover. “Doors are just one of a variety of tools that a developer can use when designing levels,” Galbraith says. “Many games employ other methods alongside doors to avoid potential issues and even just to help vary the content.”
With one exception: “Unless the door was really tiny and cute, in which case then it’s just a-door-able!”
 / Sign up for Verge Deals to get deals on products we've tested sent to your inbox weekly.
The Verge is a vox media network
© 2024 Vox Media, LLC. All Rights Reserved"
"Amazon expands gamification program that encourages warehouse employees to work harder","https://www.theverge.com/2021/3/15/22331502/amazon-warehouse-gamification-program-expand-fc-games","Mon, 15 Mar 2021 07:00:00 GMT","The Verge","By  Nick Statt, is a Senior Producer on Decoder. Previously, he wrote about technology and gaming for Naavik, Protocol, and The Verge.
If you buy something from a Verge link, Vox Media may earn a commission. See our ethics statement.
Amazon is expanding an existing program that gamifies warehouse work to encourage its fulfillment center employees to improve their efficiency and compete against others for digital rewards like virtual pets, according to a new report from The Information. The program is called FC Games, and it includes as many as six arcade-style mini-games that can be played only by completing warehouse tasks in the workplace. 
It’s been known since at least 2019 that Amazon uses gamification in the form of workstation games to try to incentivize employees to improve productivity, but The Information reports that Amazon is now expanding those methods to warehouses in at least 20 states throughout the country. Many of the games tend to be simple virtual representations of how fast the worker is completing a task. One, called MissionRacer, moves a car around a track while a picking employee sorts products into appropriate boxes, as reported by The Washington Post at the time. 
“Employees have told us they enjoy having the option to join in these workstation games, and we’re excited to be taking their feedback and expanding the program to even more buildings throughout our network,” Kent Hollenbeck, an Amazon spokesperson, tells The Information. “Even with this expansion, the program remains completely optional for employees; they can switch in or out of different games depending on their preference, can play anonymously, or not play at all—the choice is theirs.”
Amazon uses mini-games at its warehouse workstations to improve productivity
Some employees quoted in the report say the games are popular because they can help cut down on the tediousness and repetition of a nearly half-day warehouse shift. Others fear it’s one step toward an even more sinister and dystopian metrics system designed to track employees and encourage them to work as hard and fast as possible. One employee recalled the image of humans measured through gamification metrics in the infamous season 1 episode of British science fiction show Black Mirror, “Fifteen Million Merits,” in which people cycled on exercise bikes for enough tokens to compete on a talent show-style reality TV program.  
The rewards earned by playing the workstation games can be turned in for virtual pets, including penguins and dinosaurs, according to The Information, although it’s not clear these pets have any value or whether they can be changed for anything. Another of Amazon’s mini-games is called Tamazilla, a play on the popular Bandai digital pet product Tamagotchi, while others are more competitive and pit employees’ scores against workers at other warehouses around the country. 
As The Washington Post reported in 2019, some employees have used FC Games performance to ask for more so-called swag bucks, a proprietary Amazon currency that can be exchanged for company merchandise like T-shirts and water bottles. The Information report also says that during busy holiday rushes, warehouse employees can win pricey consumer electronics, like game consoles or an Apple Watch, by performing well. 
But the games themselves are not designed to reward employees with tangible, real-world benefits, the report says, and are instead ways for Amazon to encourage productivity as warehouse work becomes increasingly more tedious. 
The company is in the years-long process of automating many elements of warehouse work using robotics. The ultimate goal is ostensibly to eliminate the most repetitive and dangerous jobs. Yet, the result of this hybrid workplace in the interim is that humans are being forced into more specialized, often rote roles that involve less movement and more repetition with an increasing focus on metrics that gauge work performance like one measures the effectiveness of a robot. 
In many cases, robots fetch items and bring them to humans to sort, and Amazon has not shied away from its ambitions to automate large swaths of its warehouse work in the future. Yet, Amazon warehouses with automation have been shown to actually have higher injury rates than those that rely entirely on humans. 
 / Sign up for Verge Deals to get deals on products we've tested sent to your inbox weekly.
The Verge is a vox media network
© 2024 Vox Media, LLC. All Rights Reserved"
"20 Bethesda games will be available on Xbox Game Pass Friday","https://www.theverge.com/2021/3/11/22325044/microsoft-xbox-game-pass-bethesda-games-list","Thu, 11 Mar 2021 08:00:00 GMT","The Verge","By  Tom Warren, a senior editor covering Microsoft, PC gaming, console, and tech. He founded WinRumors, a site dedicated to Microsoft news, before joining The Verge in 2012.
Microsoft finalized its Bethesda acquisition earlier this week, and now the company is revealing which existing games will appear on Xbox Game Pass. In total 20 Bethesda titles will appear in Xbox Game Pass on Friday, including Dishonored, Doom, The Elder Scrolls, Fallout, and Wolfenstein.
Microsoft says 16 of the games will also be available across Xbox, PC, and xCloud, and that “a handful of these games will also benefit from FPS Boost on Xbox Series X / S.” This means some games will even include frame rate improvements, using the new Xbox FPS Boost feature that was announced last month.
Here’s the full list of Bethesda Xbox Game Pass games:
 / Sign up for Verge Deals to get deals on products we've tested sent to your inbox weekly.
The Verge is a vox media network
© 2024 Vox Media, LLC. All Rights Reserved"
"Original Xbox and Xbox 360 games arrive on Microsoft’s xCloud streaming service","https://www.theverge.com/2021/3/31/22360211/microsoft-xbox-360-xcloud-backward-compatible-games","Wed, 31 Mar 2021 07:00:00 GMT","The Verge","By  Tom Warren, a senior editor covering Microsoft, PC gaming, console, and tech. He founded WinRumors, a site dedicated to Microsoft news, before joining The Verge in 2012.
Microsoft is bringing 16 original Xbox and Xbox 360 games to the company’s Xbox Cloud Gaming (xCloud) service today. Titles like Elder Scrolls III: Morrowind, the original Banjo-Kazooie, and Fallout: New Vegas are all now available to stream to Android devices. Microsoft is also enabling touch controls for Jetpac Refuelled, Viva Pinata, and Viva Pinata TIP.
The 16 games will be available to Xbox Game Pass Ultimate members and streamable to Android phones and tablets. “We’ve listened to the feedback, going all the way back to our earliest cloud gaming preview, and making games from previous generations available on mobile devices has been one of the most requested features by the community,” says Microsoft.
Microsoft is also still planning to extend xCloud game streaming to iOS this spring. The software maker hasn’t revealed exactly when its iOS preview will go live, but Microsoft has previously promised both iOS and web browser streaming for xCloud in spring 2021. Game streaming will be available in the Xbox app for Windows 10 PCs, too.
We got an early look at how xCloud will work on Windows 10 last month, alongside an exclusive first look at the web version of the service. Microsoft is also testing 1080p streams for xCloud, and this will likely debut with the Windows version of the app.
For now, here are the original Xbox and Xbox 360 games making their way to Xbox Cloud Gaming today:
 / Sign up for Verge Deals to get deals on products we've tested sent to your inbox weekly.
The Verge is a vox media network
© 2024 Vox Media, LLC. All Rights Reserved"
"Jade Raymond announces new Sony game studio just weeks after leaving Stadia","https://www.theverge.com/2021/3/16/22334101/jade-raymond-haven-game-studio-playstation","Tue, 16 Mar 2021 07:00:00 GMT","The Verge","By  Megan Farokhmanesh
Longtime industry veteran Jade Raymond is heading up a new studio that will create original games for PlayStation. Raymond announced the news today via the PlayStation Blog. “We want to create worlds where players can escape, have fun, express themselves, and find community,” Raymond wrote about the new studio, Haven. “We want to pour our passion into a project. We want to make something wondrous for people to experience.”
Raymond is one of the game industry’s most prolific developers; her career’s spanned major stints at companies like Electronic Arts and Ubisoft in leadership roles. Most recently, she was leading Google’s first-party games studio, Stadia Games and Entertainment. Earlier this year, however, Google shut down its in-house developer. Although many other devs shifted to new roles, Raymond left the company entirely.
“It’s been a strange and difficult past 12 months,” Raymond wrote. “The pandemic, social injustice, and job elimination have impacted many of my closest friends, family, and co-workers. All of these factors, paired with an inability to see friends and family face-to-face, lulled me into a kind of self-reflective cocoon where I had to ask myself some tough questions about what really matters.”
 / Sign up for Verge Deals to get deals on products we've tested sent to your inbox weekly.
The Verge is a vox media network
© 2024 Vox Media, LLC. All Rights Reserved"
"How to use your Oculus Quest 2 to play any PC VR game wirelessly","https://www.theverge.com/22218827/oculus-quest-2-wireless-pc-vr-games-how-to","Fri, 30 Apr 2021 07:00:00 GMT","The Verge","By  Cameron Faulkner
If you buy something from a Verge link, Vox Media may earn a commission. See our ethics statement.
One of the best features of the Oculus Quest and Quest 2 is that they can be manually linked via USB to your gaming PC so you can play more demanding VR games that couldn’t otherwise be run natively on the headsets. That’s great if you want a way to play games like Half-Life: Alyx, but the obvious downside is that you’re now physically tethered to a PC — so much for the wireless freedom that the Quest platform advertises.
Since then, the developers at Virtual Desktop — and, more recently, Oculus itself — have both figured out how to stream the visual feed from your PC to your VR headset while quickly syncing all of your movements over Wi-Fi. Either option will give you the best of both worlds: letting you play the games you want without being attached by a cable to your computer. 
Oculus’ method, which is called Air Link, now comes as a complimentary feature with the headset (if you’re running v28 software), while using Virtual Desktop requires a $20 app. There are benefits to both options, so we’re going to walk you through setting up each of them. 
Up first is Oculus Air Link.
In late April 2021, Oculus released the v28 software containing Air Link, a feature that enables wireless PC streaming. To check if your Quest is running the right software: 
Now, you need to enable the feature within the Oculus app on your PC. First off, make sure that app is updated to v28, like the headset. 
Now that your software is updated and the feature has been turned on at your host PC, you can enable it within the headset. To do this:
The Oculus app for PC must remain open for your headset to connect to it over Wi-Fi. 
If you need to make quick adjustments to Air Link’s bit rate to optimize performance (or if you want to quit using Air Link and return to the Quest interface), the left-most option at the bottom of your field of view will pull up a menu (shown below) that lets you do either.
The Virtual Desktop app also lets you access your PC through the lens of a Quest VR headset. You can use it for games, like we’ll be doing here, but you can also watch movies you have stored on your PC in a variety of different virtual environments, or just browse the internet. There’s a Quest-specific version of the app that you can purchase here for $20. (Make sure it says that it’s compatible with Quest underneath the purchase button.)
Compared to using Air Link, Virtual Desktop doesn’t take you completely out of the Quest interface. You can still hit the Oculus button on the right Touch controller to see the Quest universal menu. Yet, it allows for far more fine-tuning than Air Link currently does. You can adjust myriad settings to find the perfect performance for your setup, and it even has some extra tweaks, like letting you choose the kind of virtual environment the app will boot into. There’s an apartment, a computer room, an auditorium, and the vast expanse of deep space, to name a few examples. 
Get Virtual Desktop if you really want to have a custom experience, or as an alternative if Air Link doesn’t work all that well for you.
There’s yet one more application to download for your PC: Virtual Desktop Streamer. It’s free, and made by the same folks who made the Virtual Desktop app you purchased on the Quest or Quest 2. This app is necessary for streaming PC content to your headset via Wi-Fi. 
You should see your PC pop up in the list of available devices to connect to from within the Virtual Desktop app on your Quest or Quest 2.
Once you’ve connected, the Options button (the left Touch controller’s equivalent of the Oculus button) is mapped to open up the top-level menu for Virtual Desktop, as shown in the image below. From there, clicking “Games” will reveal every game that’s installed on your PC. You can simply boot each one from there, and your PC will handle all of the hard work of opening the necessary apps. 
If you aren’t happy with the visual fidelity within each game, you’re free to customize some settings that affect latency, refresh rate, and more. Note that you’ll likely get a clearer, more fluid image if your PC is powerful. Your wireless router plays a huge role in delivering a smooth experience, too.
Streaming VR over Wi-Fi certainly isn’t a perfect solution. I play just a few feet away from a Wi-Fi 6-ready router that’s wired directly to my PC via an ethernet switch, yet I still experience the occasional spot of lag and slightly fuzzy image. Though with enough tweaking on the Virtual Desktop app (turning Wi-Fi off on seldom-used tech items never hurts), I think you’ll have a good time.
Update April 30th, 9:16AM ET: Updated this post with the steps involved for setting up Air Link for Oculus Quest and Quest 2.
Correction: The original article erroneously suggested that internet speed played a role in your ability to use this wireless solution to play your VR games. It’s all handled locally. Also, due to a malfunctioning USB-C port on the author’s PC, they erroneously stated that the USB-C cable included with each Quest 2 couldn’t be used to complete this how-to. A reader pointed out that it will work, and the author confirmed it by using the cable with an OTG adapter. We regret these errors.
 / Sign up for Verge Deals to get deals on products we've tested sent to your inbox weekly.
The Verge is a vox media network
© 2024 Vox Media, LLC. All Rights Reserved"
