Title,Link,Published,Source,Content
"Best Apple TV+ original streaming shows, according to critic reviews",https://www.businessinsider.com/apple-tv-plus-original-shows-ranked-by-critic-score-2021-5,"Mon, 10 May 2021 07:00:00 GMT",Business Insider,"Description: ""When new evidence compels podcaster Poppy Parnell (Octavia Spencer) to reopen the murder case that made her a national sensation, she comes face to face with Warren Cave (Aaron Paul), the man she may have mistakenly helped to put behind bars. Her investigation navigates urgent concerns about privacy, media and race.""
Critic score: 31%
What critics said: ""With a stacked cast and a premise that gives way to a wealth of ideas, Truth Be Told could have been a solid story about many things. However, Truth Be Told doesn't work and instead it's the rare crime mystery where I don't care about getting to the end."" — Observer (season one)
Description: ""From visionary executive producers Steven Spielberg and Edward Kitsis & Adam Horowitz, this reimagining of the classic anthology series transports everyday characters into worlds of wonder, possibility, and imagination.""
Critic score: 40%
What critics said: ""Maybe the show will get better; I hope it does. But with so many shows on so many different platforms right now, it seems like Amazing Stories blew its one chance to make a good first impression."" — IGN (season one)
Description: ""In the far future, a virus has decimated humankind. Those who survived emerged blind. Jason Momoa stars as Baba Voss, the father of twins born centuries later with the mythic ability to see — who must protect his tribe against a powerful yet desperate queen who believes it's witchcraft and wants them destroyed. Alfre Woodard also stars as Paris, Baba Voss' spiritual leader.""
Critic score: 43%
What critics said: ""As the show leans heavily on gore and predictable plot points, it proves that, at the very least, Apple has figured out the dirty truth of making TV: Even the strongest story pitches can blindly wander into a puddle of mediocrity."" — Washington Post (season one)
Description: ""A brilliant rebel (Justin Theroux) and his wife (Melissa George) take their family on the run to protect them, but end up exposing them to more danger than ever. At every turn of their adventure, they encounter increasing threats and intensifying moral choices from which there's no turning back.""
Critic score: 60%
What critics said: ""The Mosquito Coast works best when you just follow along with the running and don't think too hard about the rest, but the running itself becomes tedious after awhile. Not everything makes perfect sense, or seems remotely plausible."" — Los Angeles Times (season one)
Description: ""What happens when the people you trust to tell the truth prove themselves to be dishonest? The Morning Show follows the free fall of an early morning newscast in the wake of a scandal, and its struggle to survive in an era when news arrives in the palm of your hand. The Morning Show stars Academy Award winner Reese Witherspoon, Emmy winner Jennifer Aniston and Golden Globe winner Steve Carell in a high-stakes drama that pulls back the curtain on the morning news.""
Critic score: 61%
What critics said: ""Sadly, by its finale, The Morning Show is less addictive train wreck than glum clunker, symptomatic of peak TV: it's yet another lacquered, poorly structured ten-episode story, whose sparks are dampened as it becomes more earnest."" — New Yorker (season one)
Description: ""In this gripping, character-driven thriller, a shocking crime rocks a small Massachusetts town and one family in particular, forcing an assistant district attorney to choose between his sworn duty to uphold justice and his unconditional love for his son.""
Critic score: 72%
What critics said: ""You've seen it before, perhaps, but don't let that stop you. 'Defending Jacob' is gripping enough in its own way, despite some of the familiar moves, and the acting is consistently fine."" — Boston Globe
Description: ""In this internationally acclaimed psychological thriller, Alice is a middle-aged film director who feels lost since raising her family. But a chance meeting with Sophie, a femme-fatale screenwriter, takes Alice on an obsessive journey toward success at any cost.""
Critic score: 76%
Audience score: 78%
What critics said: ""An immensely compelling drama, if an overlong one, and a heroine who is, title notwithstanding, anything but lost."" — Wall Street Journal
Description: ""From Emmy Award-winner J.J. Abrams, Grammy, Emmy and Tony Award-nominee Sara Bareilles and Jessie Nelson, Little Voice is a new coming-of-age drama series featuring original music from Sara Bareilles. A love letter to the diverse musicality of New York starring Brittany O'Grady, Sean Teale, Colton Ryan, Shalini Bathina, Kevin Valdez, Phillip Johnson Richardson and Chuck Cooper, Little Voice follows Bess King, a uniquely talented performer struggling to fulfill her dreams while navigating rejection, love, and complicated family issues.""
Critic score: 76%
Audience score: 82%
What critics said: ""While it often crosses the line into saccharine, Little Voice is an engine of joy, driven by great music and even catchier, unforgettable characters."" — RogerEbert.com (season one)
Description: ""A mystery inspired by the reporting of a real nine-year-old journalist. When a young girl and her family move back to the small town her father left behind, her pursuit of the truth leads to the unearthing of a long-buried cold case.""
Critic score: 81%
What critics said: ""The main attraction, from start to finish, is the insouciance and conviction that Prince brings to her portrayal of a child who suffers for being an outsider but refuses to give into pressure from family, schoolmates, teachers and police to just go along."" — New York Times (season one)
Description: ""From M. Night Shyamalan, Servant follows a Philadelphia couple in mourning after an unspeakable tragedy creates a rift in their marriage and opens the door for a mysterious force to enter their home.""
Critic score: 85%
What critics said: ""Rupert Grint still impresses as Dorothy's wine-swilling, foul-mouthed brother, Julian (wash your mouth out, Ron Weasley!). And Ambrose releases the throttle fully for a performance of even more delicious derangement."" — Empire Magazine (season two)
Description: ""For All Mankind is created by Emmy Award winner Ronald D. Moore (Outlander, Battlestar Galactica), Matt Wolpert and Ben Nedivi. Told through the lives of NASA astronauts, engineers and their families, For All Mankind presents an aspirational world where NASA and the space program remained a priority and a focal point of our hopes and dreams.""
Critic score: 86%
What critics said: ""Its bona fides stem from many corners — terrific production design, visual effects that might be TV's best, stellar performances from a beautifully chosen ensemble cast — but its overall quality can also be traced back to its showrunner Ronald D. Moore."" — Vox (season two)
Description: ""Dickinson is a half-hour comedy series starring Oscar nominee Hailee Steinfeld. Created by Alena Smith, Dickinson audaciously explores the constraints of society, gender and family from the perspective of rebellious young poet Emily Dickinson.""
Critic score: 87%
Audience score: 86%
What critics said: ""It is imperfect and strange and easy to love. Sometimes the ride is bumpy, but that doesn't mean it isn't worth taking the trip."" — Indiewire (season two)
Description: ""All Nikki (Esther Smith) and Jason (Rafe Spall) want is a baby—but it's the one thing they just can't have. How are they going to fill the next 50 years if they can't start a family? They already went through The Sopranos in a weekend. After ruling out every other option, Nikki and Jason decide to adopt and are confronted by a world of bewildering new challenges. With their dysfunctional friends, screwball family, and chaotic lives, will the adoption panel agree that they're ready to be parents?""
Critic score: 87%
Audience score: 92%
What critics said: ""At its best, Trying candidly lays bare the emotional filigree of failing to conceive a child and choosing to devote your life to a tiny stranger. At its worst, it yokes us to two unlikeable people who grind you down with their endless neuroses."" — Hollywood Reporter (season one)
Description: ""Jason Sudeikis plays Ted Lasso, a small-time college football coach from Kansas hired to coach a professional soccer team in England, despite having no experience coaching soccer.""
Critic score: 91%
What critics said: ""On Ted Lasso, American innocence, humility, and heroism are all alive and well-and you don't have to consciously notice any of that for it to bring you comfort."" — Slate (season one)
Description: ""Based on the buzzy French series of the same name, Calls is a groundbreaking immersive television experience that masterfully uses only audio and minimal abstract visuals to tell bone-chilling snackable stories. Launching in a binge model worldwide, all nine 12-minute episodes are told through a series of phone calls that use sharp writing, compelling voice talent and graphics to aid in transcribing the darkly dramatic conversations onto the screen. These relatable scenarios transport the audience into familiar situations that quickly become surreal with thrilling and frightening moments. Featuring Lily Collins, Rosario Dawson, Mark Duplass & more, Calls proves that the real terror lies in one's interpretation of what they cannot see on the screen and the unsettling places one's imagination can take them.""
Critic score: 93%
What critics said: ""While the audio is the focus of the production, what's intriguing about this otherwise good-but-not-great story is that it has some of the charm and simplicity of audio-only storytelling, with some of the advantages of visual cues."" — NPR (season one)
Description: ""Central Park is an animated musical comedy from Emmy Award-winner Loren Bouchard (Bob's Burgers) that follows the exploits of a family living in the world's most famous park. The series voice cast includes Josh Gad, Leslie Odom, Jr., Kristen Bell, Kathryn Hahn, Tituss Burgess, Daveed Diggs, and Stanley Tucci.""
Critic score: 94%
Audience score: 71%
What critics said: ""Public parks are the pressure valves of any major metropolis ... That sense of civic pride suffuses Central Park, a delightful animated comedy created by Bob's Burgers team Loren Bouchard and Nora Smith with Josh Gad."" — Time (season one)
Description: ""A new espionage thriller from Fauda writer Moshe Zonder that tells the thrilling story of a Mossad agent who goes deep undercover on a dangerous mission in Tehran that places her and everyone around her in dire jeopardy."" 
Critic score: 94%
Audience score: 77%
What critics said: ""While it would've benefited from sharper storytelling and editing, Tehran still manages to pull off the daunting task of telling personal stories while looking at the long history of political tensions between two nations."" — AV Club
Description: ""Inspired by the true stories featured in Epic Magazine, Little America goes beyond the headlines to bring to life the funny, romantic, heartfelt and surprising stories of immigrants in America. The first season consists of eight half-hour episodes, each with its own unique story from different parts of the world.""
Critic score: 95%
What critics said: ""Its ambitions aren't flashy, but Little America leads with a clear investment in the kinds of people often relegated to the background of other shows. It's a smart, empathetic choice."" — The Atlantic (season one)
Description: ""With the quarantine finally over, the new season of Mythic Quest finds everyone back in the office (well, almost everyone), attempting to build upon the success of Raven's Banquet by launching an epic new expansion, but Ian (Rob McElhenney) and the newly promoted co-creative director, Poppy (Charlotte Nicdao), struggle with the game's direction. Meanwhile, C.W. (F. Murray Abraham) reconciles some unresolved issues from his past, the testers (Ashly Burch and Imani Hakim) test the bounds of an office romance, and David (David Hornsby) loses yet another woman in his life as Jo (Jessie Ennis) leaves him to assist Brad (Danny Pudi).""
Critic score: 97%
What critics said: ""Mythic Quest continues to level up in Season Two, even with the characters all back in the office together. It's now a consistently funny show, on top of an emotionally effective one."" — Rolling Stone (season two)
When you buy through our links, Insider may earn an affiliate commission. Learn more.
Jump to"
Apple vs. Epic Games: 5 most interesting secrets revealed in filings,https://www.businessinsider.com/apple-fortnite-epic-games-lawsuit-secrets-revealed-2021-5,"Sat, 08 May 2021 07:00:00 GMT",Business Insider,"Apple and the maker of ""Fortnite"" are currently at war in a California courtroom — the culmination of a yearlong spat between the two American business giants.
Epic Games filed suit against Apple last summer after its hit game, ""Fortnite,"" was pulled from Apple's App Store. 
Apple says it pulled the game because Epic violated the terms of its developer agreement when Epic implemented a payment system in the game that enabled players to circumvent Apple's App Store. Epic says the App Store is a monopoly, and argues that iPhones and iPads are no different from computers.
The in-person trial began Monday at the US District Court for the Northern District of California in Oakland, California. Judge Yvonne Gonzalez Rogers is scheduled to oversee approximately three weeks of hearings before a verdict is rendered, according to court filings.
After just one week, we've already learned a lot: Between major financial disclosures, company secrets, and private emails between executives made public, evidence in the trial is a treasure trove of information.
After nearly two decades of sales, Xbox consoles have never been a profitable product for Microsoft.
The Washington-based tech giant sells every Xbox at a loss, according to sworn testimony from Microsoft's VP of Xbox business development Lori Wright.
""Has Microsoft ever earned a profit on the sale of an Xbox console?"" she was asked on Wednesday, May 5. ""No,"" she said.
Wright appeared as a witness in the ongoing trial, where she answered a variety of questions about Microsoft, Xbox, and digital storefronts. Microsoft has openly supported Epic's suit against Apple. 
The subject of Xbox profitability came up in questioning because of how Microsoft's console business works: Instead of making money on the console itself, the company makes money from games sales through its digital storefront, from subscription services like Xbox Game Pass, and from sales of accessories like gamepads.
Microsoft, like other console makers, takes a cut of every sale on its digital storefront. That cut is usually about 30%, which has become a standard in the video game distribution market. Apple takes a similar cut from games sold on its iOS App Store, which is part of what Epic is contesting in its court case against Apple.
One of Epic's expert witnesses, Berkeley Research Group managing director Ned Barnes, said that Apple is enjoying enormous margins on the App Store: In the high 70s for the last two years at least, according to Barnes. 
""In my expert report dated February 16, 2021,"" Barnes writes, ""using Apple testimony and financial information available to me at that time, I calculated the App Store's operating margin percentage to be 79.6% for each of FY2019 and FY2018.""
He also said that Apple ""produced additional documents"" for the trial that demonstrate slightly lower percentages for the two years, but that the numbers are ""consistent with and confirm the reasonableness of the calculations presented in my expert report."" 
Apple, however, disputes Barnes' report. ""Epic's experts calculations of the operating margins for the App Store are simply wrong,"" an Apple representative told The Verge.
Core to Epic's argument in the trial is that Apple operates a monopoly with the App Store by refusing to allow competing app stores on the iOS platform, in addition to not allowing third-party payment systems. High profit margins from the App Store, Epic argued, is part of the reason for Apple won't allow either.
In one of the less surprising secrets unearthed from evidence presented during the trial, ""Fortnite"" is making a huge amount of money — to the tune of several billion dollars every year for the last several years.
In 2020 alone, Epic made over $5 billion in revenue according to sworn testimony from Epic Games CEO Tim Sweeney. Between 2018 and 2019, ""Fortnite"" brought in over $9 billion.
Epic makes more than ""Fortnite"" — the gaming giant produces the Unreal Engine, operates the Epic Games Store, and owns and publishes several other big games (""Rocket League"" and ""Fall Guys""). Data from Epic presented during the trial shows that those projects, while moneymakers in the hundreds of millions, don't generate anywhere near as much revenue as ""Fortnite.""
At 2 a.m. PT on August 13, 2020, Epic Games CEO Tim Sweeney sent an email to Apple CEO Tim Cook and several other Apple executives that laid out Epic's plan to cut Apple out of payments in ""Fortnite"" on iPhone and iPad.
It was intended as a declaration of war.
""I'm writing to tell you that Epic will no longer adhere to Apple's payment processing restrictions,"" Sweeney wrote. ""Today, Epic is launching Epic direct payments in 'Fortnite' on iOS, offering customers the choice of paying in-app through Epic direct payments or through Apple payments, and passing on the savings of Epic direct payments to customers in the form of lower prices.""
In response, Apple pulled ""Fortnite"" from its iPhone and iPad store, and the game has been unplayable on both ever since. Epic sued Apple on the same day, and this email was one of many private messages between the companies that was uncovered as evidence.
In September 2018, after months spent fighting a losing battle in the court of public opinion, Sony gave in: ""Fortnite,"" the company announced, would be playable on the PlayStation 4 with friends on other platforms. 
""Fortnite"" was the first-ever game to allow players on all platforms to play together. ""This represents a major policy change for Sony Interactive Entertainment,"" Sony said in its announcement. It was clear at the time that, with the game playable across all other platforms, Sony was almost certain to give in: Tens of millions of people were playing ""Fortnite,"" and they were earning the most from players on Sony's PlayStation 4, according to documents from Epic presented as evidence in the trial.
Between January 2019 and July 2020, just before ""Fortnite"" was removed from the App Store, Epic was earning just shy of $150 million each month on average from PlayStation players, according to Epic. By comparison, the company was earning about $23 million per month on average from iOS players, Epic said.
Got a tip? Contact Insider senior correspondent Ben Gilbert via email (bgilbert@businessinsider.com), or Twitter DM (@realbengilbert). We can keep sources anonymous. Use a non-work device to reach out. PR pitches by email only, please.
Jump to"
