Title,Link,Published,Source,Content
"Apple's iPad Pro has all of the makings of a great computer, but it's still not ready to replace my laptop",https://www.businessinsider.com/guides/tech/apple-ipad-pro-2020-review,"Wed, 14 Apr 2021 07:00:00 GMT",Business Insider,"When you buy through our links, Business Insider may earn an affiliate commission. Learn more

Apple took another step in turning the iPad into a viable laptop alternative in 2020, thanks to two important launches: its powerful iPad Pro, and a software update that makes Apple's current iPad lineup compatible with computer mice and trackpads.
The latter is a long-awaited feature that makes Apple's tablets much more useful when it comes to work-related tasks. It's especially important for the productivity-oriented iPad Pro, which starts at $800 if you opt for the 11-inch version and $1,000 if you get the larger 12.9-inch version.
Apple is positioning the iPad Pro not as a laptop replacement, but as a new type of computer that can handle everything a traditional laptop can and more. In terms of achieving that goal, Apple's newest iPad Pro succeeds in some regards and falls short in others.
Yes, the iPad Pro's slim and light design, smooth touchscreen with support for Apple Pencil, and powerful cameras make it ideal for certain situations that a regular laptop would be less-equipped to handle.
However, since it runs on software that was designed with mobile-first usage in mind, it's also struggled to feel as seamless and natural when being used as a laptop. Its lack of mouse support was one of the major factors contributing to that latter point — until now.
Overall, the 2020 iPad Pro impresses with sharp design, fast performance, long battery life, and useful trackpad support. But, even with these benefits, there's still a learning curve you'll have to embrace if you want to use it as your everyday work machine. Here's a closer look at what it's been like to use the new iPad Pro.
But it would be wise to hold off on purchasing just yet. Apple is holding an event on April 20th where refreshed iPad Pros are expected to make their debut. These new iPads are expected to be even better-equipped for productivity, as Bloomberg reports they'll come with faster processors similar to Apple's M1 chip. The larger model may also have a new mini-LED screen with better contrast. 
Updated on 4/14/21 by Sarah Lord: This story was originally published on 4/14/20 but has been updated to include details on new iPad Pro models expected to debut soon. 
Before we dig in, here's a look at what you'll get with the base model, which has an 11-inch screen and starts at $800. For this review, I used the 12.9-inch model with 1TB of storage.
The iPad Pro may be Apple's largest and most powerful iPad, but it's still impressively thin and light. At 0.23 inches thin, it's just about as slim as the iPad Air and a bit sleeker than the 0.33-inch Microsoft Surface Pro 7.  It's also lighter than Microsoft's productivity tablet: the 12.9-inch iPad Pro with Wi-Fi and cellular weighs 643 grams, while the Surface Pro 7 weighs 775 grams, if you're going for a Pro 7 with an Intel Core i3 or i5 chip — which you should. 
Like the 2018 iPad Pro, the 2020 version has noticeably narrower bezels framing its screen compared to the iPad Air and entry-level iPad. That also means there's no home button, so you'll have to use Face ID or a passcode to unlock the device and swipe up from the bottom of the screen to navigate home.
The 12.9-inch iPad Pro's 2,732 x 2,048 display is vibrant, smooth, and sharp. It has a higher 120Hz refresh rate through a feature Apple calls ProMotion, which not only prevents any lag while using the Apple Pencil, but also makes the interface feel snappier overall since the screen feels more responsive. The iPad Pro display also supports True Tone color adjusting technology, which has become a mainstay of Apple's products, making the screen feel warmer and less blue than some non-Apple alternatives. 
Being able to use a mouse and trackpad has been a game changer for the iPad Pro. Although the iPad Pro's software needs some work before it can truly take over for my laptop, I wouldn't have even considered using an iPad as my daily driver before Apple added this capability.
But, don't expect it to feel like the mouse and trackpad experience on a Mac or PC. Apple has tailored the way the cursor works to make it fit more smoothly with the iPad's interface. The cursor conforms to specific buttons and elements through the iPad's software. When viewing apps in split screen mode, for example, your cursor will take the shape of the dividing line in the center of the screen, making it easy to be precise.
Although computer mice will work just fine with the iPad, I found that trackpads offer a far superior experience. That's because you can use a lot of the familiar gestures you're accustomed to on the touchscreen, like swiping up to access the dock, with a trackpad. When using a mouse, I more often found myself switching between using the touchscreen and the mouse, whereas I felt like I was able to accomplish everything I needed with just the trackpad.
Apple has added a lot of features to the iPad in recent years that make it better-equipped to handle work-related tasks. There's a proper file manager in Apple's Files app, for example, which lets you access documents stored on your iPad and in other places, like iCloud Drive. It's also added the ability to view apps in split-screen mode, support for external drives in the Files app, and a new home screen that lets you see information like upcoming calendar appointments alongside your apps, among other improvements.
While these are all helpful and appreciated changes, you should still expect to encounter a learning curve if you're planning to use the iPad Pro for many of the same tasks as your Mac or PC laptop. You can't drag, drop, and resize windows around the home screen like you can in a desktop environment, which in my experience can make it hard to get the most out of the iPad Pro's 12.9-inch display. Instead, if you want to work quickly you'd better get deeply acquainted with Apple's multitasking gestures.
Apple's Slide Over and Split View features are the closest you'll get to this experience, but they're still not quite the same. With Slide Over, you can open an app in a sidebar and position it alongside the left or right side of the screen. Split View, as its name implies, allows you to view two apps simultaneously alongside one another. You can also open a third app in Slide Over while two apps are running in Split View. 
There are also still some aspects of the way I work that don't translate particularly well to mobile. For example, I typically keep services like Google Drive and Slack open in my web browser, since I find it easier to quickly switch between tabs rather than navigating between different programs. This can be annoying, and in some cases impossible on the iPad. Google encourages you to use the Drive app instead, and Slack requires you to download the app to use it on mobile devices.
That means my only choices are quickly jumping between Slack and Google Chrome throughout the workday, or keeping Slack open in split screen or slide-over view, both of which are more cramped experiences than I'd like.
That's not to say the recent features aren't a big improvement. Being able to view two apps alongside one another and easily access files saved in iCloud Drive means I'm able to get a meaningful amount of work done on the iPad Pro that I would have struggled with in the past. But, it's just not seamless enough to take over as my primary work device just yet.   
Where the iPad Pro has the potential to truly shine over a laptop is in its performance. While opening more than a dozen tabs on my new 2020 MacBook Air and 2017 MacBook Pro will sometimes result in sluggish performance and whirring fans, this was never an issue on the iPad Pro. I breezed through my work with more than 12 tabs open without and stuttering, lag, or overheating.
Apple's 2020 iPad Pro runs on the company's new A12Z processor, which Apple claims should offer more power and sharper graphics, thanks in part to improvements in the GPU's thermal architecture and performance controllers. The previous generation iPad Pro, by comparison, is powered by Apple's A12X chipset. Apple's A12Z has eight processing cores, while the Microsoft Surface Pro 7 is configurable up to a quad-core Intel 10th generation Core i7 processor. 
Apple claims that the iPad Pro can last for up to 10 hours while browsing the web on Wi-Fi or streaming video, and I find that to be generally accurate. I used the iPad Pro sporadically over the course of about a week, which typically involved using it as my main work computer for a portion of the work day and then using it to browse the web, shoot and render video clips, manage email, and occasionally use AR apps otherwise.
Overall, I used the iPad Pro for about 10 hours before the battery died, which seems to line up with Apple's projections. It's important to remember, however, that battery life will always vary depending on how you use your device. If you're consistently streaming video or editing high-resolution footage, or if you keep the screen brightness high, your battery will probably drain faster. 
If you're planning to take photos or shoot video with your iPad Pro, you can expect similar image quality to the iPhone 11. Like Apple's iPhone, the iPad Pro has a wide-angle camera and an ultra-wide-angle camera, except there's one important difference.
While both devices have a 12-megapixel wide camera, the iPad Pro has a 10-megapixel ultra-wide-angle camera, which is a slightly lower resolution than the iPhone 11's 12-megapixel ultra-wide-angle shooter. There's also a 7-megapixel camera for selfies and video calls, which is also isn't as sharp as the iPhone 11's 12-megapixel selfie camera.
Still, the iPad Pro does offer higher resolution cameras than the Surface Pro 7, which has an 8-megapixel rear camera and a 5-megapixel front camera. 
But, it's the iPad Pro's LiDAR sensor that Apple is strongly positioning as being one of the characteristics that makes it stand out. This sensor is geared toward improving performance in augmented reality (AR) apps, as it measures the distance between objects by detecting how long it takes for light to reach an object and reflect back.
In general, most of the AR apps I used on the iPad Pro were capable of detecting surfaces quick and easily. However, existing AR apps will have to build support for Apple's new Scene Geometry application programming interface (API) into their apps to get the most out of the iPad Pro's LiDAR sensor. That tool should help developers build apps that can more accurately understand the size and dimensions of your environment.
Apple's Measure app is probably the best and most practical example of how the new Scene Geometry API and LiDAR sensor can be put to good use. When used on the LiDAR-equipped iPad Pro, the digital tape measure app can provide horizontal and vertical guide lines and instantly measure a person's height from the floor to the top of their head.
Overall, the iPad Pro is faster and more accurate when it comes to detecting surfaces through the Measure app than my iPhone 11 Pro. When trying to measure the length of my couch, for example, the iPad Pro detects the surface nearly instantly, whereas my iPhone is a little slower to recognize the starting point.
The iPad Pro's biggest drawback is that it's expensive, and that high price can make you question whether a laptop or a cheaper tablet may be better suited for your needs. 
The iPad Pro starts at $800 for the 11-inch model and $1,000 for  the 12.9-inch version, with the latter being the same price as the newest MacBook Air. That price gets even higher when you tack on the accessories that make the iPad Pro so appealing in the first place.
The newest Apple Pencil will cost you $130, while the company's Smart Folio Keyboard costs $180 for the 11-inch model and $200 for its larger sibling. Apple's brand-new Magic Keyboard is priced at $300 for the 11-inch model and $350 for the 12.9-inch version.
That means, if you're opting for the smaller iPad Pro even with a basic keyboard that lacks a trackpad, then you're still spending nearly $1,000. 
The iPad Pro is a powerful, sleek  computer with a fantastic display and long battery life. Support for trackpads and computer mice only makes it more useful as a productivity machine, making it possible to get real work done on the iPad for the first time. 
That being said, the software experience still isn't quite as capable and flexible as that of a laptop running on macOS or Windows. You can't, for example, launch multiple apps in floating windows as you would on a laptop. 
The iPad Pro is also expensive, and getting the most out the experience by adding one of Apple's keyboard accessories or the Apple Pencil will require even more spending. The iPad Pro may be ideal for artists, designers, and architects that could greatly benefit from using a computer that can scan it's environment using high-quality cameras or that has a super-responsive screen for lag-free digital sketching.
But, if you're looking for a tablet for web browsing, occasional note taking, managing email, and watching Netflix, the less expensive $500 iPad Air may be a better option.
Or, if you're looking for a laptop that's as portable and flexible as a tablet, it may be worth considering Microsoft's Surface Pro 7 or another Windows-based laptop-tablet hybrid.
Pros: Long battery life, lightweight design, trackpad support makes it easier to get work done, fast performance
Cons: Expensive, software is still somewhat limiting compared to a laptop
Jump to"
How Apple is pitching its new ad format,https://www.businessinsider.com/insiders-top-advertising-and-media-stories-for-april-27-2021-4,"Mon, 26 Apr 2021 07:00:00 GMT",Business Insider,"Hi and welcome to Insider Advertising for April 27. I'm senior advertising reporter Lauren Johnson, and here's what's going on:
If this email was forwarded to you, sign up here for your daily insider's guide to advertising and media.
Tips, comments, suggestions? Drop me a line at LJohnson@businessinsider.com or on Twitter at @LaurenJohnson.
Thanks for reading and see you tomorrow! You can reach me in the meantime at LJohnson@businessinsider.com and subscribe to this daily email here.
Jump to"
"An MBA helped a consultant get job offers from Apple, EY, and HP",https://www.businessinsider.com/mba-part-time-consultant-job-offers-apple-ey-hp-2021-4,"Tue, 06 Apr 2021 07:00:00 GMT",Business Insider,"Lisa Andrea, 32, knew exactly what she wanted to do after college: She wanted to pursue her MBA, become a certified public accountant, and work for a Big Four accounting firm.
""That was my dream,"" Andrea, who asked to use a different last name in compliance with her company, told Insider.
But with student loans to cover, she decided to take on a full-time role right after school — having graduated in under four years — save some money, and build up her résumé.
After she spent two years working in marketing, she enrolled in a part-time MBA program at San Diego State University with an emphasis on accounting, which required her to study twice a week at night for four hours.
""I had talked with many C-suite executives of different corporations before applying to grad programs to get their advice on the type of school to go to,"" she said about her application process. ""Unanimously, every person I spoke with said not to spend the money on an expensive university, unless it was a top-10 program like Yale, Harvard, etc.""
Andrea is glad she listened to their advice. Instead of ending up with a price tag upward of $200,000, she paid about $20,000 total in tuition. It took her two years (with summer school) to finish.
""Since I was very diligent about not wasting any money, I planned my entire schedule for the two years before I started the program,"" Andrea said. ""I wanted to make sure I didn't waste any time or money. So I made sure to plan my schedule so that my classes could be taken at the proper times to stay on track.""
The MBA candidate also tested out of nine units based on curricula from her undergraduate degree, so she took the exact number of classes that were required.
Through San Diego State's job-postings website, Andrea ended up getting a high-paying internship with the Big Four accounting firm Ernst & Young in the last semester of her MBA program.
""I quit my marketing job that I really loved to go after my dream of being a CPA,"" she said.
After she completed the six-month internship, Andrea was offered a full-time position at EY. But she had other offers as well. During her internship, she had applied to jobs online and interviewed at other Fortune 100 companies, finding posting through her school's MBA career site and on her own.
""I was then faced with four incredible job offers from Fortune 100 companies — two of which were Apple and HP — all because of my MBA,"" Andrea said. ""This is one of the biggest advantages to a graduate program. Access to employers that want you.""
In the end, Andrea ended up turning down offers from Ernst & Young and Apple — two of her dream offers. ""Yes, that's still crazy to say,"" she said.
She accepted the job at HP, she said, because it offered her four times as much money as the other options.
""I decided I couldn't ignore something like that,"" she said. ""At 24 years old, my new job allowed me to pay off my MBA and undergraduate degree very quickly.""
For the past eight years, Andrea has been working as a business-development consultant — a job that she loves.
""I work from home, travel the world, have given speeches in front of thousands of people, and have worked with some of the largest organizations in the world,"" she said. ""The opportunities that have opened for me are truly incredible.""
On the side, she's the owner of The Financial Cookbook, which she uses to provide career-empowerment coaching to other women. Andrea started her business because she realized there was a market gap between what people learn in school about personal finances and the real-world needs that people face with money management.
""Some people live unfulfilling careers or struggle with financial freedom simply because they don't know what they don't know,"" she said.
Andrea attributes her successful job experiences in the corporate world, as well as her ability to launch her own venture, to earning her MBA. ""Do I use my MBA now, or do I need it for my current job? No,"" she said. ""Was it worth it, and would I recommend it? One hundred percent yes.""
Having an MBA changes the game in many ways for those who earn one, she added.
""Employers saw me differently from the undergraduates I was up against,"" she said. ""Getting a graduate degree has an unsaid connotation behind it. It says to the employer that you're a go-getter who wants to expand your horizons and learn.""
She also said it was extremely impressive to the companies where she interviewed that she already had four years of full-time work experience under her belt. ""This showed them how strong my work ethic is since I was working full time and going to school at night,"" she said.
""Most top executives have a graduate degree,"" Andrea added. ""Therefore, when they realize that you do as well, they view you differently. You now have additional topics to converse about. It helps you to build rapport with others in life and executives within your organization.""
Jump to"
