Title,Link,Published,Source,Content
"Investor Ryan Cohen Shares Warren Buffett Lessons, Explains Apple Bet",https://www.businessinsider.com/chewy-ryan-cohen-warren-buffett-lessons-apple-investment-2020-10,"Tue, 02 Feb 2021 08:00:00 GMT",Business Insider,"Ryan Cohen ignored the naysayers when he cofounded an online pet-supplies retailer in 2011 and squared off against Amazon and Pets.com.
He ultimately sold the company for $3.4 billion in 2017, and stepped down as CEO the following year to spend more time with his family and pursue personal goals.
Cohen broke with convention again by investing the vast majority of his wealth in two stocks, Apple and Wells Fargo. He later placed a contrarian bet on GameStop and secured three seats on the video-game retailer's board in January, laying the groundwork for an astronomical rally in its stock price.
The entrepreneur attributes his independent streak to the ""two biggest influences on my professional life"": his father, Ted Cohen, who passed away in December 2019, and Warren Buffett, the billionaire investor and Berkshire Hathaway CEO.
""Something critical that I learned from my dad and Warren Buffett was the ability to separate myself from the herd and think independently,"" Cohen told Insider in an October interview.
The pair's teachings allow him to ""block out the noise, develop my own point of view, and not be influenced by daily headlines or the consensus or what's in style.""
For example, many people initially doubted Chewy would be able to ship 30-pound bags of pet food to customers and make any money.
""In the early years, few investors thought Chewy was a good idea,"" Cohen said. ""I struck out raising capital over 100 times.""
Ignoring the skeptics, as well as avoiding distractions and saying ""no"" to all but the best opportunities, enabled Cohen to focus on the things most critical to Chewy's success: competitive prices, compelling products, fast shipping, and personalized customer service.
The former Chewy chief credited his dad, who ran a glassware-importing business, with giving him the courage of his convictions.
Cohen's father taught him to trust his instincts, treated him like an adult from an early age, solicited and listened to his opinions, and demonstrated what it meant to deeply understand a business.
""I learned how to build my company by watching him build his,"" Cohen said.
After selling Chewy, Cohen plowed the bulk of his windfall into Apple and Wells Fargo, flouting traditional investment advice about the need for a diversified portfolio.
Cohen felt comfortable with his decision partly because he bought his first Apple share at age 15, making it one of the first stocks he ever owned. The technology titan's ecosystem of hardware, software, and services — which makes it a headache for users to switch to rival products — was a key attraction, he said.
Apple's offerings have become even more integral to people's lives during the pandemic, Cohen argued. People increasingly rely on their iPhones, iPads, MacBooks, and apps to keep in touch with friends and family, work from home, conduct daily tasks such as shopping and banking, and entertain themselves.
""The strongest business in the world,"" Cohen proclaimed, echoing Buffett's comment in February 2020 that Apple is ""probably the best business I know.""
Cohen also brushed off concerns about Apple's valuation, arguing that it's relatively cheap when rock-bottom interest rates mean bonds are yielding close to zero.
Cohen declined to comment on his Wells Fargo and GameStop investments.
Cohen's emphasis on focus, independent thought, and investing with conviction aren't the only strategies he shares with Buffett.
The Chewy cofounder cited 'disciplined capital allocation,"" or spending money strategically and responsibly, as a key driver of his company's success. Buffett specializes in taking the cash flowing into Berkshire from its scores of subsidiaries, and redeploying it where it's needed most.
Cohen focused on selling pet food at Chewy, because he recognized that customers would slash every expense they could before cutting back on feeding their pets, resulting in a ""sticky"" customer base.
Consumables offered slimmer profit margins than toys or accessories, but the lifetime value of their buyers relative to the cost of acquiring them meant they generated higher returns in the long haul, he added.
Buffett famously favors companies that sell essential or staple products and services to a dedicated customer base. For example, Berkshire counts American Express, Visa, Mastercard, Coca-Cola, Procter & Gamble, and Kraft Heinz among the roughly 45 stocks in its portfolio.
Cohen and Buffett also have investments in common. Apple is by far the most valuable holding in Berkshire's portfolio, and the conglomerate owned $3 billion worth of Wells Fargo stock at the last count.
Finally, Cohen practices Buffett's advice to ""be greedy when others are fearful.""
""Value doesn't move but stock prices do, creating an opportunity if you have the right temperament to buy stuff on sale,"" he said.
Jump to"
UK Regulator Opens Probe Into Apple's App Store 30% Commission,https://www.businessinsider.com/apple-app-store-commission-developer-tax-uk-regulator-cma-investigation-2021-3,"Thu, 04 Mar 2021 08:00:00 GMT",Business Insider,"Britain's competition regulator said on Thursday it has opened an investigation into Apple after complaints that the iPhone maker's terms and conditions for app developers are unfair and anti-competitive.
The probe will consider if Apple has a dominant position in the distribution of apps on its devices in the UK, the Competition and Markets Authority (CMA) said.
Payment policies related to Apple's App Store have for long drawn complaints from app developers. It charges a commission of up to 30% from developers on the value of transactions or any time a consumer buys their app.
The iPhone maker said it will work with the regulator.
""The App Store has been an engine of success for app developers, in part because of the rigorous standards we have in place — applied fairly and equally to all developers — to protect customers from malware and to prevent rampant data collection without their consent,"" Apple said in a statement.
The company is also being investigated on similar grounds by the Dutch competition authorities, who are nearing a draft decision, Reuters reported last month.
Last year, the European Commission too had opened a probe into the iPhone maker over the App Store commission fee.
""Complaints that Apple is using its market position to set terms which are unfair or may restrict competition and choice – potentially causing customers to lose out when buying and using apps – warrant careful scrutiny,"" CMA Chief Executive Andrea Coscelli said.
Jump to"
"How to use apple cider vinegar to help you lose weight, according to dietitians",https://www.businessinsider.com/guides/health/diet-nutrition/apple-cider-vinegar-weight-loss,"Thu, 01 Apr 2021 07:00:00 GMT",Business Insider,"The wellness trend of drinking apple cider vinegar — or fermented apple juice — has recently gained popularity due to claims it aids in weight loss, among many other benefits. While some small studies indicate apple cider vinegar may help with weight loss, more research is needed to determine its long-term effects and overall health benefits. 
Here's what the research says about apple cider vinegar and weight loss, and what you need to know before trying it. 
Yes, apple cider vinegar may help with weight loss according to some small studies, but it most likely will not help you shed substantial pounds, says Daniela Novotny, RD, a senior instructor of biomedical sciences at Missouri State University. 
Studies on the effects of apple cider vinegar so far are small and more research is needed to draw definitive conclusions about its effects, says Melissa Mitri, a registered dietitian with her own private practice. Here is what the research says: 
Other studies have shown that vinegar may also increase satiety, resulting in fewer calories consumed and, therefore, aid weight loss. 
Medical term: Satiety is the feeling of fullness after eating. Increasing satiety means you are less likely to overeat, which causes you to consume fewer calories.
Therefore, apple cider vinegar may have a modest effect on weight loss, but studies so far on the topic are limited, and more substantial research is needed, Mitri says. 
For the most part, apple cider vinegar is safe to consume, Novotny says. But, due to its high acidity, there are some potential side effects, like:
When consumed in moderation, apple cider vinegar doesn't appear to pose any significant health risks, Novotny says. If you do decide to try apple cider vinegar for weight loss, here are some safe ways to consume it:
General advice: For weight loss, Mitri recommends consuming apple cider vinegar in the morning or right before a meal as there is some evidence it may help with satiety. 
Since the research hasn't definitively proven apple cider vinegar helps with weight loss for all, there isn't good data to suggest how long you may need to take it to see results. The limited human studies suggest apple cider vinegar may help promote weight loss in obese people over a three-month period, but larger studies are needed in order to make recommendations, Mitri says. 
Important: When incorporated as part of a well-rounded diet, apple cider vinegar may help you lose weight. However, developing an individualized weight loss plan focused on nutrition and exercise with your doctor or a registered dietitian is likely to be more effective, Novotny says. 
Some small studies have indicated apple cider vinegar may help with weight loss, but more research is needed. Even so, it most likely will not help you shed substantial pounds, and it's best to create a comprehensive weight loss plan with a doctor or registered dietitian.
If you decide to try apple cider vinegar, dilute it in water or use it to make your own salad dressing. If you decide to consume apple cider vinegar stick to about one to two tablespoons a day. 
Jump to"
How Apple can crack down on fake apps in the iOS App Store,https://www.businessinsider.com/how-apple-crack-down-fake-apps-scams-ios-app-store-2021-3,"Tue, 23 Mar 2021 07:00:00 GMT",Business Insider,"The open secret of the iOS App Store is that it's rife with scams. And it's not hard to see them if you look for more than a few minutes. 
Last month, a developer posted a thread on Twitter outlining how fake apps are scamming customers through a combination of fake reviews, ""free"" apps that require you to start a trial before you can use the app, and weekly subscriptions. That developer has since filed a lawsuit against Apple, alleging the company allows these scams ""to make billions of dollars in profits at the expense of small application developers and consumers.""
This highlights the dilemma facing Apple, which became the most valuable company in large part because of the iPhone and the $500 billion ecosystem of apps that surrounds it. It also draws attention to the control Apple exerts over the App Store at a time when it's already under intense scrutiny for that very thing.
Apple's argument is that its guidelines and policies are designed to protect consumers. I'm inclined to believe that Apple means that, but the problem is that its actions don't back that up. 
The iOS App Store developer guidelines say: ""We work hard to make the App Store a trustworthy ecosystem and expect our app developers to follow suit; if you're dishonest, we don't want to do business with you.""
But Apple does business with plenty of dishonest developers that make these apps.
I certainly don't think Apple endorses any of these scam apps, at least not directly. But by not taking a tougher stance, it's hurting both consumers and legitimate developers who are working hard to build apps that add value to users' lives.
An even bigger problem is that fixing this means cracking down on an extremely lucrative business for Apple. The App Store brings in an estimated $64 billion a year for Apple, and that number is growing.
Apple takes 30% of in-app purchases and either 15 or 30% of subscription fees. A lot of that is for games, which make up an estimated 66% of total revenue on iOS — games, of course, aren't necessarily scams, though they do have their own problems.
CEO Tim Cook has made no secret of the fact that Apple's services division is an important focus for the company, and the App Store is a big contributor to the bottom line.
It's hard to know exactly what percentage of the App Store revenue comes from scams (Apple didn't immediately respond to a request for comment). But in some ways, it doesn't matter — it seems pretty clear that Apple's values and interests are in conflict.
Scams hurt the trust consumers place in the platform, and Apple is hurting the legitimate developers that have helped make the App Store so valuable.
Many of the worst offenders simply rip off the name or identity of whatever app happens to be No. 1 on the charts to mislead users into downloading theirs instead. There are ways that Apple could fix the problem with a little transparency and a few changes.
One of the ways apps take advantage of users is by offering a weekly, instead of a monthly, subscription. Since most people are used to signing up for something on a monthly basis, it isn't always obvious that the $10 you just agreed to pay is going to be charged every week. It doesn't help that the confirmation screen when you make an in-app purchase isn't exactly clear or make this obvious.
Apple could definitely make that confirmation more clear about what you're agreeing to pay, but one of the most obvious ways to cut down on the number of apps that are taking advantage of users is to eliminate weekly subscriptions altogether. 
Presumably, the ability to bill customers on a weekly basis exists for things like newspaper subscriptions, but that doesn't seem necessary, considering it isn't how people are really used to buying apps. Plus, there's really no benefit to charging users this way that isn't outweighed by the potential for confusion and poor experience.
Apple has started sending a notice to apps that appear to be charging exorbitant subscription fees, but that, in and of itself, is problematic. In an email that was reviewed by 9to5Mac, Apple told a developer whose app had been rejected: ""Unfortunately, the prices you've selected for your app or in-app purchase products in your app do not reflect the value of the features and content offered to the user. Charging irrationally high prices for content or services with limited value is a rip-off to customers and is not appropriate for the App Store.""
That Apple can tell you that it doesn't think your app justifies whatever you've decided to charge shows how much control it has over developers. 
But I don't think Apple should be deciding if your subscription fee is justified — users should. Apple's role should be to make sure that it's clear to users what they can expect to pay and make sure that apps aren't using shady practices to trick users into something they weren't expecting. 
Another problem is when an app will simply have a welcome screen that requires you to start a subscription to use the app. In most cases, those subscriptions will offer a week or 14-day free trial to still qualify as ""free,"" but that's not really what a user expects when they download a free app.
For example, as pointed out by Kosta Eleftheriou, the developer suing Apple, a simple search for ""Roku TV remote control"" returns a free third-party app called Roku Remote Control - Roki. But when you launch the app, you can't do anything before you're met with a page to sign up. There are no other options to use the ""free"" app other than signing up for a three-day free trial, after which you'll be charged $5 a week. Never mind there's already a Roku official remote app that's actually free.
There should be some degree of usability and functionality included at no cost, and a user can decide whether they want to pay for more. Forcing them to sign up first, even for a ""trial,"" is a terrible experience and designed only to take advantage of users.
As I mentioned before, another problem is copycat apps. When an app becomes popular, less-scrupulous developers release apps that often infringe on the original app's name or icon.
For example, that's exactly what happened when Widgetsmith became the No. 1 app in the US after it went viral on TikTok. A search, at the time, for Widgetsmith revealed a top result that was a complete copy.
It doesn't seem like it would be complicated for Apple to implement a system where apps have to have unique names that aren't in use by other apps. Especially if a developer has trademarked a name, no other developer should be allowed to use that to promote their own app, and certainly not in the name itself.
It's one thing to want to advertise your ad as an alternative to something that people are highly interested in, but that's not the same as attempting to blatantly mislead consumers.
The developer guidelines tell developers that ""your app's functionality should be clear to end users and App Review,"" but just because you describe something that's factually accurate doesn't mean it will meet a user's expectations. 
For example, if you designed a weather app that ""shows current conditions,"" a user might expect that it would display the current weather for their location. But what if it showed the weather for only one location, predetermined by the app unless you pay a subscription fee? 
Technically, that would still fit the app's description, but it wouldn't in any way fit a user's expectations.
Or how about an app that says it will ""clean up the storage on your iPhone""? For example, Boost Cleaner says it will clean up the storage on your iPhone with ""one tap."" Really, once you tap that, it asks you to subscribe. Even if you do it, it just lets you review your photos, videos, or contacts to delete, something you can already do on your own. 
The app provides no new functionality. Of course, it also wants to charge you $4 a week. 
Ultimately, Apple has to decide whether it will come down on the side of protecting users or protecting the bottom line. I'm pretty confident Apple will say it always stands on the side of the former, and generally speaking, that would be good for the latter in the long run anyway. Now it's time for its actions to agree. 
Jump to"
What devices work with Apple Fitness Plus? Here's what's compatible with Apple's workout app,https://www.businessinsider.com/guides/tech/what-devices-work-with-apple-fitness-plus,"Wed, 17 Mar 2021 07:00:00 GMT",Business Insider,"Apple Fitness Plus, Apple's subscription exercise program, integrates pre-recorded workouts in a wide range of categories with your Apple Watch and iPhone, iPad, or Apple TV. Apple Fitness Plus costs $9.99 per month or $79.99 per year, and there is an option for a free trial when you sign up.
The app allows you to choose workouts like high-intensity interval training (HIIT), yoga, strength, treadmill, cycling, rowing, and more. Here's how to make sure you have everything you need to get started with Apple Fitness Plus.
You need an Apple Watch Series 3 or later, plus an iPhone, iPad, or Apple TV to follow Fitness Plus exercises. Any of these devices must be running OS version 14.3 or higher.
An Apple Watch Series 3 or newer is required for every Fitness Plus user. Aside from that, however, you can use a variety of devices:
These are the compatible iPhone models: 
These are the compatible iPad models:
You can also use an Apple TV HD or an Apple TV 4K.
Additionally, when iOS 14.5 is released, Apple Fitness Plus will become compatible with AirPlay 2. This means that you'll be able to stream the Fitness app from your iPhone or iPad to an AirPlay 2-compatible device like a TV, set-top box, or streaming media player (such as Roku). 
Apple Fitness Plus offers a lot of workout options, many of which don't require any equipment other than your body. Some workouts have unique equipment requirements, though.
The good news is that you can use any generic equipment to do the workout — Fitness Plus doesn't require you to have a particular brand or model of workout equipment. You can also do these workouts at home or at a gym.
Each workout indicates what equipment you need at the top of the screen, under the introductory image. If there's no equipment listed, you won't need any gear (except, of course, for the obvious treadmill if you've chosen a treadmill workout, for example).
However, if you want to explore a wide range of Fitness Plus exercises, you may want access to at least some of this equipment.
You'll be able to see exactly what you'll need for each workout before you start.
Rowing machine
Insider Inc. receives a commission when you buy through our links.
Jump to"
How to use Apple Cash to send or request money through a text message on your iPhone or iPad,https://www.businessinsider.com/guides/tech/how-to-use-apple-cash,"Fri, 26 Mar 2021 07:00:00 GMT",Business Insider,"With apps like Venmo and Cash App becoming more and more commonplace these days, other companies are trying to get in on the action by creating their own peer-to-peer money transfer apps.
One of these companies is Apple. Apple Cash — which is different from Apple Pay, the virtual wallet that stores your credit cards on your phone to use in stores — is Apple's money transfer service.
Like other apps, Apple Cash lets you send money to your friends quickly and easily. The only catch is that your friends also need to have a compatible Apple device, and need to link it to their bank account.
If you're interested in signing up and trying Apple Cash for yourself, here's what you need to know.
In order to use Apple Cash, you need to be over the age of 18, and have:
Quick tip: Apple Cash is also available in a limited form on any Apple Watch with watchOS 4.2 or later, and any Mac with Touch ID.
You'll also have to add an eligible debit card from a participating bank or credit union to your Apple Wallet.
Before you're able to set up Apple Cash, you'll also need to enable two-factor authentication for your Apple ID. And of course, you have to be signed into iCloud on any device you want to send or receive money on. 
Once you've added a debit card and got Apple Pay ready, you can turn on Apple Cash in your iPhone or iPad's Settings app.
Under ""Payment Cards,"" tap ""Apple Cash"" or ""Apple Pay Cash"" and follow the instructions on the screen to set up your Apple Cash Card. Any time you send or receive money, it'll automatically be loaded to this virtual card. 
You can transfer the money on the card to your bank at any time — you'll only be charged a fee if you need to transfer funds instantly. This fee is 1% of the funds you transfer.

To use your Apple Cash card to send payments to others, it first has to have money on it. There are two ways to make this happen: Add the money yourself, or receive money from someone else using Apple Cash.
1. Open the Wallet app and tap your new Apple Cash card.
2. Tap the three dots in the top-right corner to bring up the menu.
3. To add money to your Apple Cash card, tap the ""Add Money"" button right underneath the name of the card.
4. Type in how much you want to add, then tap ""Add"" in the top-right corner. The minimum amount you can add is $10.
To transfer money off of your card and back into your bank account or onto your debit card, follow these same steps — just tap the ""Transfer to Bank"" button instead of the ""Add Money"" button.
Once you've added money, you can send it. Unlike Venmo or Cash App, Apple Cash doesn't have its own app — instead, you go through the messages app.
1. Start or open a conversation with the person you want to send money to or request from. Remember that they need to have a compatible Apple ID and device too. 
2. Tap the apps button to the left of the text box to bring up a list of apps you can use in Messages.
3. Tap the Apple Pay button.
4. Enter the amount you want to send or request, either using the directional arrows or by bringing up the full keypad, then tap either ""Pay"" or ""Request.""
If all you wanted was to request money, that's all you have to do — your payment won't go through until the other person accepts it on their end. If you're sending money, there's one more step.
5. The payment will appear in the text box. Double check that the amount is correct, then tap the send button, and verify with your Face ID, Touch ID, or Apple ID password.
Insider Inc. receives a commission when you buy through our links.
Jump to"
